{
  "document": { "sourceId": "org.tsuyomi.yamibo", "remoteBookId": "42", "contentId": "thread-42-page-3", "revision": "2026-08-08T00:00:00Z" },
  "blockId": "post-9001",
  "textAnchorDigest": "0000000000000000000000000000000000000000000000000000000000000000",
  "characterOffset": 0,
  "chapterProgress": 0.4,
  "bookProgress": 0.2,
  "capturedAt": "2026-08-08T00:00:00Z"
}
